{
  "kind": "EvaluationPlan",
  "schema_version": "1.0.0",
  "plan_id": "aging-sk-stage1-synthetic-plan-v2",
  "case_id": "aging-sk-bidirectional-development-v2",
  "stage": 1,
  "execution_class": "synthetic",
  "status": "frozen",
  "study_mode": "exploratory",
  "metric_ids": [
    "P1",
    "P2",
    "P3"
  ],
  "target_metric_ids": [
    "P2",
    "P3"
  ],
  "bindings": {
    "rubric": {
      "version": "aging-bidirectional-rubric-v1",
      "path": "rubrics/aging-bidirectional-rubric.v1.json",
      "canonical_sha256": "5c3248197d7e88723925734641a6944840041c4f47d3223b5f97958d5476b977"
    },
    "criterion_catalog": {
      "path": "rubrics/aging-bidirectional-criteria.v1.jsonl",
      "sha256": "ab175e1ebbf6c399e84808ba16f094b4b141776edd23ece79c829d1dfd73efdd",
      "record_count": 86
    },
    "holdout": {
      "manifest_id": "holdout-synthetic-v2",
      "path": "examples/holdout-manifest-v2.synthetic.json",
      "canonical_sha256": "137e7ae51b8651e3c92fe4b655cd38714e8fbface841d39d7fb2fda9d2693c07",
      "use_class": "synthetic"
    },
    "prompt": {
      "version": "llm-agent-simulation-v3-single-prompt",
      "artifact": {
        "path": "examples/prompt.synthetic.txt",
        "sha256": "cccccccccccccccccccccccccccccccccccccccccccccccccccccccccccccccc"
      }
    },
    "condition_map": {
      "path": "private/condition-map.synthetic.json",
      "sha256": "dddddddddddddddddddddddddddddddddddddddddddddddddddddddddddddddd"
    },
    "baseline_build": {
      "version_id": "stock-codex-synthetic-v1",
      "capability_ids": [],
      "core_revision": "1111111111111111111111111111111111111111",
      "extension_revision": null,
      "reviewed_diff_sha256": null,
      "changed_owner_paths": []
    },
    "treatment_build": {
      "version_id": "stage1-harness-synthetic-v2",
      "capability_ids": [
        "validator:holdout-manifest-v2",
        "validator:stage1-evaluation-result-v2"
      ],
      "core_revision": "1111111111111111111111111111111111111111",
      "extension_revision": "2222222222222222222222222222222222222222",
      "reviewed_diff_sha256": "7777777777777777777777777777777777777777777777777777777777777777",
      "changed_owner_paths": [
        "plugins/auto-research-agent/validators/holdout_manifest_v2.py",
        "plugins/auto-research-agent/validators/stage1_evaluation_result_v2.py"
      ]
    },
    "capability_registry": {
      "path": "capability-metric-map.v1.json",
      "canonical_sha256": "e917fe00dea0f8ce81001077ab04aa06238073cabc3d5b71682f6ebd526c2ac0"
    }
  },
  "subject_runtime": {
    "model_id": "gpt-5.6-sol",
    "reasoning": "high",
    "mode": "default",
    "tool_profile_id": "stock-search-v1",
    "search_enabled": true,
    "data_cutoff": "2026-09-17",
    "time_limit_policy": "no-artificial-limit",
    "human_assistance_policy": "clarification-only",
    "app_version": "synthetic-app-v1",
    "system_instructions_sha256": "3333333333333333333333333333333333333333333333333333333333333333",
    "project_instructions_sha256": "4444444444444444444444444444444444444444444444444444444444444444",
    "tool_profile_sha256": "5555555555555555555555555555555555555555555555555555555555555555",
    "loaded_extensions": [],
    "environment_profile_sha256": "6666666666666666666666666666666666666666666666666666666666666666",
    "fixed_limit_seconds": null
  },
  "judge_configs": [
    {
      "role": "auto-r1",
      "config_id": "aging-r1-v1",
      "model_id": "gpt-5.6-sol",
      "reasoning": "high",
      "prompt_sha256": "eeeeeeeeeeeeeeeeeeeeeeeeeeeeeeeeeeeeeeeeeeeeeeeeeeeeeeeeeeeeeeee",
      "condition_blinded": true,
      "evaluation_config_sha256": "8888888888888888888888888888888888888888888888888888888888888888",
      "execution_context_id": "judge-context-1"
    },
    {
      "role": "auto-r2",
      "config_id": "aging-r2-v1",
      "model_id": "gpt-5.6-sol",
      "reasoning": "high",
      "prompt_sha256": "eeeeeeeeeeeeeeeeeeeeeeeeeeeeeeeeeeeeeeeeeeeeeeeeeeeeeeeeeeeeeeee",
      "condition_blinded": true,
      "evaluation_config_sha256": "8888888888888888888888888888888888888888888888888888888888888888",
      "execution_context_id": "judge-context-2"
    },
    {
      "role": "auto-adj",
      "config_id": "aging-adj-v1",
      "model_id": "gpt-5.6-sol",
      "reasoning": "high",
      "prompt_sha256": "aaaaaaaaaaaaaaaaaaaaaaaaaaaaaaaaaaaaaaaaaaaaaaaaaaaaaaaaaaaaaaaa",
      "condition_blinded": true,
      "evaluation_config_sha256": "7777777777777777777777777777777777777777777777777777777777777777",
      "execution_context_id": "judge-context-3"
    }
  ],
  "paired_repeats": [
    {
      "repeat": 1,
      "order": [
        "baseline",
        "treatment"
      ],
      "baseline": {
        "run_id": "run01-a",
        "subject_id": "subject-0000000000000001"
      },
      "treatment": {
        "run_id": "run01-b",
        "subject_id": "subject-0000000000000002"
      }
    },
    {
      "repeat": 2,
      "order": [
        "treatment",
        "baseline"
      ],
      "baseline": {
        "run_id": "run02-b",
        "subject_id": "subject-0000000000000003"
      },
      "treatment": {
        "run_id": "run02-a",
        "subject_id": "subject-0000000000000004"
      }
    },
    {
      "repeat": 3,
      "order": [
        "baseline",
        "treatment"
      ],
      "baseline": {
        "run_id": "run03-a",
        "subject_id": "subject-0000000000000005"
      },
      "treatment": {
        "run_id": "run03-b",
        "subject_id": "subject-0000000000000006"
      }
    }
  ],
  "decision_rule": {
    "allow_target_regression": false,
    "allow_non_target_regression": false,
    "allow_added_major_error": false,
    "incomplete_outcome": "inconclusive",
    "no_composite_total": true,
    "statistical_claim": "direction-and-variability-only",
    "minimum_pairs_improved_per_target": 2
  },
  "human_audit": {
    "trigger_ids": [
      "major-error",
      "low-confidence",
      "evidence-unverifiable",
      "judge-disagreement",
      "close-paired-result",
      "external-claim"
    ],
    "required_before_external_claim": true,
    "missing_audit_outcome": "inconclusive"
  },
  "human_approvals": [
    {
      "actor_id": "human-organizer-a",
      "attestation_ref": "course-roster:organizer-a",
      "approved_at": "2026-09-17T14:50:00-04:00",
      "artifact": {
        "path": "private/approvals/plan-a.json",
        "sha256": "bbbbbbbbbbbbbbbbbbbbbbbbbbbbbbbbbbbbbbbbbbbbbbbbbbbbbbbbbbbbbbbb"
      },
      "actor_type": "human",
      "role": "approver"
    },
    {
      "actor_id": "human-organizer-b",
      "attestation_ref": "course-roster:organizer-b",
      "approved_at": "2026-09-17T14:55:00-04:00",
      "artifact": {
        "path": "private/approvals/plan-b.json",
        "sha256": "9999999999999999999999999999999999999999999999999999999999999999"
      },
      "actor_type": "human",
      "role": "approver"
    }
  ],
  "isolation": {
    "production_runtime_may_read_holdout": false,
    "judges_receive_condition_labels": false,
    "runner_must_attest_artifact_bytes": true,
    "runner_must_attest_process_boundary": true
  },
  "created_at": "2026-09-17T14:00:00-04:00",
  "frozen_at": "2026-09-17T15:00:00-04:00"
}
